{
  "id": "replace-with-topic-id",
  "category": "JavaScript",
  "type": "결과 예측",
  "format": "객관식 단일",
  "points": 2,
  "prompt": "실행 환경과 전제조건을 포함한 지문을 작성하세요.",
  "code": "// 문제에 제시할 코드\n// 여러 줄도 작성할 수 있습니다.",
  "options": [
    "선택지 1",
    "선택지 2",
    "선택지 3",
    "선택지 4",
    "선택지 5"
  ],
  "answer": 1,
  "explanation": "정답이 되는 이유와 주요 오답이 틀린 이유를 작성하세요.",
  "sources": [
    {
      "title": "MDN — Array.prototype.map() (문항에 맞는 근거로 교체하세요)",
      "url": "https://developer.mozilla.org/en-US/docs/Web/JavaScript/Reference/Global_Objects/Array/map"
    }
  ]
}
